after_super_class,bad_match_reason,candidates_after_super_class_guards,candidates_total,is_bad_match,match_percent,price,reason_code,ref_super_class,reference_name,rejected_by_anchor,rejected_by_forbidden,selected_name,selected_super_class,status
,,177,,False,37,63.6,,staples.рис,БУЛГУР 3 кг. Агро-Альянс,0,0,"Рис круглозерный 0,900 гр Наш урожай",staples.рис,ok
,,176,,False,63,63.6,,staples.рис,РИС жасмин экстра 3 кг. Агро-Альянс,0,0,"Рис круглозерный 0,900 гр Наш урожай",staples.рис,ok
,,77,,False,100,253.8,,staples.масло.оливковое,BORGES Масло оливковое Extra Virgin нерафинированное высшего качества 1 л ПЭТ,0,0,Масло оливковое нераф в/кач Экстра Коста Доро (250 мл),staples.масло.оливковое,ok
,,22,,False,100,493.8,,oils.frying,МАСЛО подсолнечное рафинированное дезодорированное фритюрное 5 л. IFry,0,0,"Кокосовое масло рафинированное ROI THAI 100% (1000 мл/1,100 кг) упак.",other,ok
,,41,,False,100,35.38,,condiments.mustard,ГОРЧИЦА русская ведро 1 кг. Бастион,0,0,Горчица русская 170 гр ст/б (18) Uni Dan,condiments.mustard,ok
,,42,,False,100,83.92,,condiments.ketchup,КЕТЧУП томатный пакет 2 кг. Heinz,0,0,Кетчуп томатный 900 гр п/бут(2 категория) (8) Царский,condiments.ketchup,ok
0,,,8218,,,,NO_CANDIDATES_AFTER_GUARDS,condiments.mayo,"МАЙОНЕЗ Провансаль классический 67% ведро 9,6 кг. Solpro",0,0,,,not_found
,,467,,False,100,1.58,,condiments.sauce,СОУС ананасовый с перцем чили 470 мл. Tamaki,0,0,СОУСНИК 30 мл 1 блок/80 шт. Покровский полимер,condiments.sauce,ok
,,467,,False,100,1.58,,condiments.sauce,СОУС барбекю пакет 1 кг. Heinz,0,0,СОУСНИК 30 мл 1 блок/80 шт. Покровский полимер,condiments.sauce,ok
,,467,,False,100,1.58,,condiments.sauce,СОУС горчичный балк 700 гр. Heinz,0,0,СОУСНИК 30 мл 1 блок/80 шт. Покровский полимер,condiments.sauce,ok
,,467,,False,100,1.58,,condiments.sauce,СОУС деликатесный кисло-сладкий оригинальный балк 1 кг. Heinz,0,0,СОУСНИК 30 мл 1 блок/80 шт. Покровский полимер,condiments.sauce,ok
,,467,,False,100,1.58,,condiments.sauce,"СОУС Кимчи 1,5 л. GENSO Asian style",0,0,СОУСНИК 30 мл 1 блок/80 шт. Покровский полимер,condiments.sauce,ok
0,,,8218,,,,NO_CANDIDATES_AFTER_GUARDS,condiments.mayo,СОУС майонезный легкий 28% пакет 2 кг. Heinz,0,0,,,not_found
,,467,,False,100,1.58,,condiments.sauce,СОУС на основе растительных масел горчично-медовый дип-пот 25 мл*125 шт. PIKADOR,0,0,СОУСНИК 30 мл 1 блок/80 шт. Покровский полимер,condiments.sauce,ok
,,467,,False,100,1.58,,condiments.sauce,СОУС острый с хрустящим перцем чили 210 гр. Lao Gan Ma,0,0,СОУСНИК 30 мл 1 блок/80 шт. Покровский полимер,condiments.sauce,ok
,,467,,False,100,1.58,,condiments.sauce,СОУС Ремулад 1 кг. Hellmann`s,0,0,СОУСНИК 30 мл 1 блок/80 шт. Покровский полимер,condiments.sauce,ok
,,467,,False,100,1.58,,condiments.sauce,СОУС со вкусом лемонграсса 470 мл. Tamaki,0,0,СОУСНИК 30 мл 1 блок/80 шт. Покровский полимер,condiments.sauce,ok
,,468,,False,100,1.58,,condiments.sauce,СОУС соевый порционный 30 гр.,0,0,СОУСНИК 30 мл 1 блок/80 шт. Покровский полимер,condiments.sauce,ok
,,467,,False,100,1.58,,condiments.sauce,СОУС сырный дип-пот 25 мл*125 шт. Heinz,0,0,СОУСНИК 30 мл 1 блок/80 шт. Покровский полимер,condiments.sauce,ok
,,467,,False,100,1.58,,condiments.sauce,"СОУС Терияки 1,8 л. Tamaki",0,0,СОУСНИК 30 мл 1 блок/80 шт. Покровский полимер,condiments.sauce,ok
,,467,,False,100,1.58,,condiments.sauce,"СОУС Унаги 1,5 л. GENSO",0,0,СОУСНИК 30 мл 1 блок/80 шт. Покровский полимер,condiments.sauce,ok
,,467,,False,100,1.58,,condiments.sauce,СОУС Халапеньо 470 мл. Tamaki,0,0,СОУСНИК 30 мл 1 блок/80 шт. Покровский полимер,condiments.sauce,ok
,,467,,False,100,1.58,,condiments.sauce,СОУС чесночный Ранч на основе растительных масел 1 кг. Tamaki,0,0,СОУСНИК 30 мл 1 блок/80 шт. Покровский полимер,condiments.sauce,ok
,,467,,False,100,1.58,,condiments.sauce,СОУС Шрирача 475 гр. Uni-Eagle,0,0,СОУСНИК 30 мл 1 блок/80 шт. Покровский полимер,condiments.sauce,ok
,,107,,False,100,93.05,,condiments.spice,АНИС звездчатый 70 гр. KOTANYI,0,0,"Соль нитритная ""SpicExpert"" пакет (1,000 кг/1,010 кг) упак..",condiments.spice,ok
,,81,,False,84,298.0,,condiments.broth,БУЛЬОН из баранины 2 кг. Knorr,0,0,"БУЛЬОН куриный 0,85 кг, MAREVEN FOOD, РОССИЯ",condiments.broth,ok
,,81,,False,43,298.0,,condiments.broth,БУЛЬОН рыбный концентрат Хондаши 1 кг. Китай,0,0,"БУЛЬОН куриный 0,85 кг, MAREVEN FOOD, РОССИЯ",condiments.broth,ok
,,107,,False,100,93.05,,condiments.spice,ВАСАБИ порошок 2 кг. Tamaki,0,0,"Соль нитритная ""SpicExpert"" пакет (1,000 кг/1,010 кг) упак..",condiments.spice,ok
0,,,8218,,,,INSUFFICIENT_CLASSIFICATION,,ГРИБЫ сушеные Шиитаке Китай 250 гр. GENSO,,,,,not_found
,,7,,False,100,123.9,,additives.coconut,КОКОСОВАЯ СТРУЖКА Файн 1 кг. Суприм,0,0,Кокосовая стружка 400мл (150г),other,ok
,,8,,False,100,226.2,,additives.starch,КРАХМАЛ картофельный пакет 1 кг. SpicеExpert,0,0,СУХАРИ ПАНИРОВОЧНЫЕ пакет 1 кг. SpicеExpert,other,ok
,,87,,False,31,213.5,,condiments.seasoning,ОРЕХ мускатный молотый 170 гр. KOTANYI,0,0,ПРИПРАВА хмели-сунели банка 400 гр. SpicеExpert,condiments.seasoning,ok
,,112,,False,47,39.05,,pasta,ПАСТА Карри зеленая Тайланд 400 гр. Aroy-D,0,0,СПАГЕТТИ №003 400 гр. Америа,pasta,ok
,,112,,False,54,39.05,,pasta,ПАСТА Том Кха Тайланд 400 гр. Aroy-D,0,0,СПАГЕТТИ №003 400 гр. Америа,pasta,ok
,,107,,False,100,93.05,,condiments.spice,ПЕРЕЦ черный горошек банка 600 гр. KOTANYI,0,0,"Соль нитритная ""SpicExpert"" пакет (1,000 кг/1,010 кг) упак..",condiments.spice,ok
0,,,8218,,,,INSUFFICIENT_CLASSIFICATION,,ПОРОШОК куриный 1 кг. PRB,,,,,not_found
,,86,,False,100,213.5,,condiments.seasoning,ПРИПРАВА для курицы банка 500 гр. SpicеExpert,0,0,ПРИПРАВА хмели-сунели банка 400 гр. SpicеExpert,condiments.seasoning,ok
,,86,,False,100,213.5,,condiments.seasoning,ПРИПРАВА креольская Каджун п/б 290 гр. KOTANYI,0,0,ПРИПРАВА хмели-сунели банка 400 гр. SpicеExpert,condiments.seasoning,ok
,,86,,False,100,213.5,,condiments.seasoning,"ПРИПРАВА соль для размягчения мяса п/б 1,65 кг. KOTANYI",0,0,ПРИПРАВА хмели-сунели банка 400 гр. SpicеExpert,condiments.seasoning,ok
,,152,,False,54,0.65,,staples.сахар,САХАР ванильный 1 кг. SpicеExpert,0,0,САХАР порционный в стиках 5гр 1000шт/кр CEA,staples.сахар,ok
,,57,,False,65,15.9536,,staples.соль,СОЛЬ порционная в стиках 1гр 3000шт/кр CEA,0,0,"Соль пищевая помол №1 ""СЛАВЯНОЧКА""  п/э 1кг",staples.соль,ok
,,61,,False,30,23.23,,bakery.bread,СУХАРИ панировочные Панко 1 кг. HANSEY,0,0,Дрожжи свежие хлебопекарные прессованные Люкс экстра 100 гр (20) Саф-Нева,bakery.bread,ok
,,41,,False,100,30.0,,condiments.vinegar,УКСУС рисовый 20 л. PADAM,0,0,Уксус столовый 9% 1л,condiments.vinegar,ok
0,,,8218,,,,INSUFFICIENT_CLASSIFICATION,,ШАРИКИ Рисовые Crispy Arare Кимчи Россия 1 кг.,,,,,not_found
,,153,,False,47,0.65,,staples.сахар,САХАР тростниковый кристаллический Gold в плёнке 900 гр. Цукерман,0,0,САХАР порционный в стиках 5гр 1000шт/кр CEA,staples.сахар,ok
,,107,,False,42,93.05,,condiments.spice,ОРЕХ грецкий бабочка 1 кг. Суприм,0,0,"Соль нитритная ""SpicExpert"" пакет (1,000 кг/1,010 кг) упак..",condiments.spice,ok
,,3,,False,100,449.0,,oils.sesame,СЕМЯ кунжутное белое жареное 1кг. Суприм,0,0,"Кунжутное семя белое жареное, Россия",other,ok
0,,,8218,,,,INSUFFICIENT_CLASSIFICATION,,ЛАПША Рамен яичная в брикетах 1 кг. KEKESHI,,,,,not_found
,,48,,False,33,13.5,,staples.мука.пшеничная,ЛАПША Удон 300 гр. KANESHIRO DARUMA,0,0,"ТОРТИЛЬЯ пшеничная замороженная 12 дюйм 18 шт/1620 г, MISSION, ВЕЛИКОБРИТАНИЯ",staples.мука.пшеничная,ok
,,134,,False,54,34.06,,staples.макароны,ПЕРЬЯ рифленые №023 3 кг. Federici,0,0,Макароны Дон Макарон Гурман Перья (рифленые) 400 гр (30) группа А,staples.макароны,ok
,,153,,False,100,0.65,,staples.сахар,АДРЕНАЛИН раш 0.33 л. ж/б,0,0,САХАР порционный в стиках 5гр 1000шт/кр CEA,staples.сахар,ok
,,113,,False,81,23.5,,beverages.water,"ВОДА минеральная природная столовая питьевая газированная стекло 0,375 л. «Petroglyph Epos» (Петрогл",0,0,"Вода Питьевая Негазированная 0,6л пэт Сладкая Жизнь, НДС 20%, ЧЗ",beverages.water,ok
,,16,,False,60,45.01,,beverages.нектар,ДЖ7 НЕКТАР Вишня осветленный 0.2 л. БЗ,0,0,НЕКТАР вишневый осветленный 200 мл. IL Primo,beverages.нектар,ok
,,79,,False,100,88.78,,canned.томаты.консервированные,ДЖ7 СОК Томат с солью 0.97 л. Тетра Призма,0,0,"Мелконарезанные томаты ""Мутти"" ж/б (0,210 кг) упак. .",canned.томаты.консервированные,ok
,,16,,False,62,45.01,,beverages.нектар,НЕКТАР вишневый осветленный 1 л. IL PRIMO,0,0,НЕКТАР вишневый осветленный 200 мл. IL Primo,beverages.нектар,ok
,,65,,False,40,50.41,,beverages.juice,СОК апельсиновый восстановленный 200 мл. IL Primo,0,0,СОК мультифруктовый с мякотью восстановленный 200 мл. IL Primo,beverages.juice,ok
,,64,,False,41,50.41,,beverages.juice,СОК яблочный осветленный восстановленный 1 л. IL Primo,0,0,СОК мультифруктовый с мякотью восстановленный 200 мл. IL Primo,beverages.juice,ok
,,113,,False,84,23.5,,beverages.water,"НАПИТОК безалкогольный на ароматизаторах негазированный «Dark Rum (Тёмный Ром)» 0,7 л.",0,0,"Вода Питьевая Негазированная 0,6л пэт Сладкая Жизнь, НДС 20%, ЧЗ",beverages.water,ok
,,113,,False,90,23.5,,beverages.water,"НАПИТОК безалкогольный на ароматизаторах негазированный Tiger Gin (Тигровый Джин) 0,7 л.",0,0,"Вода Питьевая Негазированная 0,6л пэт Сладкая Жизнь, НДС 20%, ЧЗ",beverages.water,ok
,,113,,False,88,23.5,,beverages.water,"НАПИТОК безалкогольный среднегазированный ""Лапочка Арбуз Мелисса"" 330 мл.",0,0,"Вода Питьевая Негазированная 0,6л пэт Сладкая Жизнь, НДС 20%, ЧЗ",beverages.water,ok
0,,,8218,,,,NO_CANDIDATES_AFTER_GUARDS,additives.coconut,НАПИТОК кокосовая вода с мякотью ж/б 330 мл. Vinut,0,0,,,not_found
,,114,,False,45,23.5,,beverages.water,НАПИТОК сокосодержащий с соком манго ж/б 330 мл. Vinut,0,0,"Вода Питьевая Негазированная 0,6л пэт Сладкая Жизнь, НДС 20%, ЧЗ",beverages.water,ok
,,8,,False,78,55.83,,beverages.лимонад,"ЛИМОНАД Bench Абрикос и Лемонграсс 0,33 л.",0,0,"Лимонад Кола 1,5 л пл/б (6) Мастер",beverages.лимонад,ok
,,32,,False,48,72.5,,fruits.лимон,ФРУСТАЙЛ Лимон Лайм 0.33 л. ж/б,0,0,ФРУСТАЙЛ Лимон Лайм 0.5 л. ПЭТ,fruits.лимон,ok
0,,,8218,,,,INSUFFICIENT_CLASSIFICATION,,ЭВЕРВЕСС Кола без сахара 0.5 л. ПЭТ,,,,,not_found
,,113,,False,78,23.5,,beverages.water,"НАПИТОК Миндальный ультрапастеризованный 1,2% BARISTA 1 л. Vega Natura",0,0,"Вода Питьевая Негазированная 0,6л пэт Сладкая Жизнь, НДС 20%, ЧЗ",beverages.water,ok
0,,,8218,,,,INSUFFICIENT_CLASSIFICATION,,ОСНОВА для безалкогольных напитков Базилик - Лимон 1 кг. Barinoff,,,,,not_found
0,,,8218,,,,INSUFFICIENT_CLASSIFICATION,,СИРОП ароматизированный со вкусом Блю кюрасао 1 л. AGROBAR,,,,,not_found
0,,,8218,,,,INSUFFICIENT_CLASSIFICATION,,СИРОП ароматизированный со вкусом Клубника 1 л. AGROBAR,,,,,not_found
0,,,8218,,,,INSUFFICIENT_CLASSIFICATION,,СИРОП Ваниль 1 л. Barinoff,,,,,not_found
,,107,,False,100,93.05,,condiments.spice,СИРОП Корица 1 л. Barinoff,0,0,"Соль нитритная ""SpicExpert"" пакет (1,000 кг/1,010 кг) упак..",condiments.spice,ok
0,,,8218,,,,INSUFFICIENT_CLASSIFICATION,,СИРОП Персик 1 л. Barinoff,,,,,not_found
,,37,,False,33,60.63,,condiments.topping,ТОППИНГ Банан 1 кг. Barinoff,0,0,"Топпинг маракуйя (1,000 кг) Barinoff",condiments.topping,ok
0,,,8218,,,,INSUFFICIENT_CLASSIFICATION,,ТОППИНГ Манго 1 кг. Barinoff,,,,,not_found
,,160,,False,49,283.32,,seafood.shrimp,ПЕРСИКИ очищенные половинки в сиропе ж/б 850 мл. LUTIK,0,0,Креветка Ванамей Торпедо 21/25 очищенная в панировке (необжар.) с/м 200 гр (10) Vici Вьетнам,seafood.shrimp,ok
0,,,8218,,,,INSUFFICIENT_CLASSIFICATION,,ИМБИРЬ маринованный белый 1 кг. RISMA,,,,,not_found
,,95,,False,37,0.33,,canned.перец.консервированный,ИМБИРЬ маринованный розовый 1 кг. VICIUNAI,0,0,"ПЕРЕЦ черный молотый порционный в стиках 0,3гр 3000шт/кр CEA",canned.перец.консервированный,ok
,,34,,False,61,78.24,,canned.кукуруза.консервированная,КУКУРУЗА ж/б 425 мл. SUNFEEL,0,0,Кукуруза консервированная 425 мл (250 гр) ж/б ключ (24) Maysun,canned.кукуруза.консервированная,ok
0,,,8218,,,,NO_CANDIDATES_AFTER_GUARDS,canned.огурцы,"ОГУРЦЫ маринованные ж/б 100/110 10,2 л. Mamminger",0,0,,,not_found
,,54,,False,44,0.77,,disposables.containers,РЕДЬКА маринованная Takuan 600 гр. HANSEY,0,0,"РАЗМЕШИВАТЕЛЬ деревянный в индивидуальной бумажной упаковке 178*6*1,3 мм 1 блок/250 шт.",disposables.containers,ok
,,60,,False,100,103.0,,canned.тунец.консервированный,ТУНЕЦ кусочки в собственном соку ж/б 170 гр. SUNFEEL,0,0,Тунец для салата консер.Санфил 170гр  б/ключа,canned.тунец.консервированный,ok
,,59,,False,100,103.0,,canned.тунец.консервированный,ТУНЕЦ филе Yellowfin Саку AAA (500-800 гр) с/м вес 650 гр.,0,0,Тунец для салата консер.Санфил 170гр  б/ключа,canned.тунец.консервированный,ok
0,,,8218,,,,INSUFFICIENT_CLASSIFICATION,,УГОРЬ филе 16-20 yнц (440-560 гр) без в/у с/м вес 5 кг. JIANGXI XILONG FOODSTUFF,,,,,not_found
,,26,,False,100,180.88,,seafood.trout,"ФОРЕЛЬ филе на коже охлажденный Трим С вес 1,1 кг (размер 3/4) Осетия",0,0,Суповой набор рыбный с/м (форель) ~1 кг ~9 кг/кор. ВРК,seafood.trout,ok
0,,,8218,,,,INSUFFICIENT_CLASSIFICATION,,ОКУНЬ филе на коже СТО (90-150 гр) с/м вес 10 кг. Купеческий,,,,,not_found
0,,,8218,,,,INSUFFICIENT_CLASSIFICATION,,СУДАК филе на коже ГОСТ (300 гр) с/м вес 10 кг. Альфа М,,,,,not_found
,,25,,False,100,625.0,,seafood.cod,ТРЕСКА филе на коже ГОСТ (400+) ДВ с/м вес 10 кг. Купеческий,0,0,Треска филе  порц. 80-120 гр.,seafood.cod,ok
,,10,,False,100,1600.0,,seafood.salmon,ЛОСОСЬ потрошеный с головой 6/7 Чили с/м вес 26 кг.,0,0,"СЕМГА свежемороженая филе Trim D 1,5-2,0 кг вакуумная упаковка, СAMANCHACA, ЧИЛИ",seafood.salmon,ok
,,77,,False,58,17.5,,bakery.buns,БУЛОЧКА для бургера черная 125 мм с/м 89 гр*24 шт. Bagerstat,0,0,"БУЛОЧКА для гамбургера с кунжутом D100 мм 52 г, BAGERSTAT, РОССИЯ",bakery.buns,ok
0,,,8218,,,,NO_CANDIDATES_AFTER_GUARDS,oils.sesame,БУЛОЧКА для гамбургера с кунжутом 125 мм с/м 82 гр*24 шт. Bagerstat,0,0,,,not_found
0,,,8218,,,,INSUFFICIENT_CLASSIFICATION,,КРУАССАН (18% сливочного масла) 80 гр*60шт/кор расстоянный Bridor,,,,,not_found
,,153,,False,53,0.65,,staples.сахар,УЛИТКА с изюмом 30 гр*260 шт/кор п/ф расстоянный ТМ Bridor Франция,0,0,САХАР порционный в стиках 5гр 1000шт/кр CEA,staples.сахар,ok
,,153,,False,32,0.65,,staples.сахар,БЕФСТРОГАНОВ из говядины в сливках с картофельным пюре с/м 260 гр. Qummy,0,0,САХАР порционный в стиках 5гр 1000шт/кр CEA,staples.сахар,ok
0,,,8218,,,,INSUFFICIENT_CLASSIFICATION,,ВАРЕНИКИ с творогом 250 гр. Qummy,,,,,not_found
0,,,8218,,,,NO_CANDIDATES_AFTER_GUARDS,meat.chicken,КУРИЦА крылышки барбекю с/м 200 гр. Qummy,12,0,,,not_found
0,,,8218,,,,INSUFFICIENT_CLASSIFICATION,,ПЕЛЬМЕНИ быстрого приготовления с куриным бульоном с/м 100 гр. 1кр/12шт,,,,,not_found
0,,,8218,,,,INSUFFICIENT_CLASSIFICATION,,СКРЕМБЛ цыпленок с грибами с/м 150 гр. Qummy,,,,,not_found
0,,,8218,,,,INSUFFICIENT_CLASSIFICATION,,УДОН с курицей и овощами с/м 250 гр. Qummy,,,,,not_found
0,,,8218,,,,INSUFFICIENT_CLASSIFICATION,,БОБЫ соевые зелёные Эдамаме Premium в стручках с/м 500 гр. Don Kreveton,,,,,not_found
,,19,,False,34,491.0,,vegetables.mushrooms.white,ГРИБЫ белые целые с/м 3 кг.,0,0,Грибы сухие Белые 40гр,vegetables.mushrooms.white,ok
,,18,,False,89,95.5,,fruits.клюква,КЛЮКВА садовая с/м 10 кг.,0,0,"МОРС клюква 18 шт х0,45 л, ЖИВАЯ ЯГОДА, РОССИЯ",fruits.клюква,ok
,,30,,False,76,80.0,,fruits.смородина,"СМОРОДИНА черная с/м 2,5 кг.",0,0,"МОРС черная смородина 18 шт х0,45 л, ЖИВАЯ ЯГОДА, РОССИЯ",fruits.смородина,ok
,,153,,False,31,0.65,,staples.сахар,"ШПИНАТ порционный листья с/м 2,5 кг.",0,0,САХАР порционный в стиках 5гр 1000шт/кр CEA,staples.сахар,ok
,,56,,False,100,152.84,,meat.kolbasa,"КОЛБАСКИ для жарки с пармезаном Гурме 3*100 гр. н/о с/м вес 0,3 кг. Поннат",0,0,"Колбаса с/в п/с Salame Classico Reserva (Салями Классико Резерва) Solemici МГС серв.нарезка (0,070 к",meat.kolbasa,ok
,,55,,False,100,152.84,,meat.kolbasa,"КОЛБАСКИ Улитка 2*100 гр. н/о с/м вес 0,2 кг. Поннат",0,0,"Колбаса с/в п/с Salame Classico Reserva (Салями Классико Резерва) Solemici МГС серв.нарезка (0,070 к",meat.kolbasa,ok
0,,,8218,,,,INSUFFICIENT_CLASSIFICATION,,КРЫЛЫШКИ куриные Баффало острые с/м 1 кг/16 шт. Черкизово,,,,,not_found
0,,,8218,,,,INSUFFICIENT_CLASSIFICATION,,"ФРИКАДЕЛЬКИ Мясные  с/м 2,5 кг. Черкизово",,,,,not_found
,,107,,False,100,93.05,,condiments.spice,"КАРТОФЕЛЬНЫЕ дольки с кожурой и специями Fry Me Premium 2,5 кг. Ви Фрай W01",0,0,"Соль нитритная ""SpicExpert"" пакет (1,000 кг/1,010 кг) упак..",condiments.spice,ok
,,159,,False,100,283.32,,seafood.shrimp,КРЕВЕТКИ ваннамей в панировке без панциря/без головы 21/25 с/м 500 гр. FISH MORE,0,0,Креветка Ванамей Торпедо 21/25 очищенная в панировке (необжар.) с/м 200 гр (10) Vici Вьетнам,seafood.shrimp,ok
,,153,,False,46,0.65,,staples.сахар,ПЮРЕ из белого персика 1 кг. AGROBAR,0,0,САХАР порционный в стиках 5гр 1000шт/кр CEA,staples.сахар,ok
,,153,,False,45,0.65,,staples.сахар,ПЮРЕ из красного апельсина 1 кг. AGROBAR,0,0,САХАР порционный в стиках 5гр 1000шт/кр CEA,staples.сахар,ok
,,153,,False,48,0.65,,staples.сахар,ПЮРЕ из маракуйи с семечкой 1кг. AGROBAR,0,0,САХАР порционный в стиках 5гр 1000шт/кр CEA,staples.сахар,ok
,,173,,False,66,22.0,,vegetables.картофель,"КАРТОФЕЛЬ фри 7 мм с/м 2,5 кг. IGLOТEX PROFESSIONAL",0,0,"БУЛОЧКА для гамбургера картофельная D100 мм 48 шт х52 г, BAGERSTAT, РОССИЯ",vegetables.картофель,ok
,,174,,False,86,22.0,,vegetables.картофель,"КАРТОФЕЛЬ фри с панировкой Fry Me Premium(бывш.Стелс/Stealth) 9*9 мм 2,5 кг. Ви Фрай S04",0,0,"БУЛОЧКА для гамбургера картофельная D100 мм 48 шт х52 г, BAGERSTAT, РОССИЯ",vegetables.картофель,ok
,,9,,False,55,627.15,,meat.lamb,"БАРАНИНА корейка 8 ребер зачищенная в/у с/м вес 1,2 кг. (2 шт по 0,6 кг) Prime lamb",0,0,БАРАНИНА тримминг (котлетное мясо) в/у с/м вес 4 кг. Prime lamb,meat.lamb,ok
,,12,,False,100,108.0,,meat.beef,"ГОВЯДИНА вырезка б/к пояснично-повздошная мышца с/м вес 1,5 кг. Пинск",0,1,Суповой набор из говядины вес,meat.beef,ok
,,12,,False,100,108.0,,meat.beef,ГОВЯДИНА лопаточный отруб без кости с/м вес 10 кг. Эталон,0,1,Суповой набор из говядины вес,meat.beef,ok
,,12,,False,100,108.0,,meat.beef,ГОВЯДИНА тазобедренный отруб внутренняя часть Topside огузок бескостная с/м вес 21 кг. Minerva Брази,0,1,Суповой набор из говядины вес,meat.beef,ok
,,12,,False,100,108.0,,meat.beef,ГОВЯДИНА мраморная боковая часть тазобедренного отруба б/к (Knuckle peeled) с/м вес 6 кг. Эталон,0,1,Суповой набор из говядины вес,meat.beef,ok
,,139,,False,74,75.0,,canned.говядина.тушеная,"ЩЕКА говяжья зачищенная с/м вес 0,7-1 кг Эталон",0,0,Доширак лапша говядина 90гр,canned.говядина.тушеная,ok
,,12,,False,100,161.74,,meat.pork,"СВИНИНА вырезка с/м вес 1,2 кг. Черкизово",0,0,"Колбаса с/в п/с из свинины Segreti d’Artigiano Фуэт Экстра в пряных травах кат А (0,110 кг)",meat.pork,ok
